{
  "schema_version": "1.0",
  "rubric_version": "1.0",
  "assessment_id": "fixture-do-not-onboard",
  "generated_at": "2026-07-27T00:00:00+00:00",
  "target": {
    "mode": "git_url",
    "source": "https://example.com/org/repo.git",
    "resolved_commit": "aaaaaaaaaaaaaaaaaaaaaaaaaaaaaaaaaaaaaaaa",
    "default_branch": "main",
    "history_complete": true,
    "analyzed_path": "/tmp/repo",
    "is_monorepo": false,
    "detected_projects": [],
    "submodules": []
  },
  "providers": [
    {
      "name": "git",
      "version": "",
      "status": "ok",
      "reason": ""
    }
  ],
  "exclusions": {
    "patterns": [
      "node_modules/**"
    ],
    "excluded_loc": 500,
    "excluded_file_count": 20
  },
  "human_inputs": {
    "business_criticality_1_5": 4,
    "roadmap_demand_next_2q": "none",
    "client_data_policy": {
      "third_party_tooling_allowed": true,
      "external_llm_allowed": true,
      "code_may_leave_premises": false
    },
    "sunset_or_replatform_planned": false,
    "sunset_target_date": null,
    "domain_expert_available": true,
    "onboarding_squad_size": 2,
    "regulatory_or_audit_constraints": null,
    "collected_at": "2026-07-27T00:00:00+00:00"
  },
  "metrics": {
    "codebase.total_loc": {
      "value": 42000,
      "unit": "loc",
      "source": "fixture",
      "confidence": "measured",
      "coverage_pct": 100,
      "notes": ""
    },
    "codebase.file_count": {
      "value": 650,
      "unit": "count",
      "source": "fixture",
      "confidence": "measured",
      "coverage_pct": 100,
      "notes": ""
    },
    "codebase.language_census": {
      "value": [
        {
          "language": "Python",
          "loc": 38000,
          "pct": 90.5,
          "files": 580
        },
        {
          "language": "Shell",
          "loc": 4000,
          "pct": 9.5,
          "files": 70
        }
      ],
      "unit": "per_language",
      "source": "fixture",
      "confidence": "measured",
      "coverage_pct": 100,
      "notes": ""
    },
    "codebase.distinct_stacks_count": {
      "value": 2,
      "unit": "count",
      "source": "fixture",
      "confidence": "measured",
      "coverage_pct": 100,
      "notes": ""
    },
    "codebase.generated_loc_pct": {
      "value": 1.2,
      "unit": "pct",
      "source": "fixture",
      "confidence": "measured",
      "coverage_pct": 100,
      "notes": ""
    },
    "codebase.largest_file_loc": {
      "value": 1200,
      "unit": "loc",
      "source": "fixture",
      "confidence": "measured",
      "coverage_pct": 100,
      "notes": ""
    },
    "codebase.avg_file_loc": {
      "value": 64.6,
      "unit": "loc",
      "source": "fixture",
      "confidence": "measured",
      "coverage_pct": 100,
      "notes": ""
    },
    "codebase.p95_file_loc": {
      "value": 310,
      "unit": "loc",
      "source": "fixture",
      "confidence": "measured",
      "coverage_pct": 100,
      "notes": ""
    },
    "vcs.history_days": {
      "value": 2200,
      "unit": "days",
      "source": "fixture",
      "confidence": "measured",
      "coverage_pct": 100,
      "notes": ""
    },
    "vcs.commits_last_90d": {
      "value": 180,
      "unit": "count",
      "source": "fixture",
      "confidence": "measured",
      "coverage_pct": 100,
      "notes": ""
    },
    "vcs.commits_last_365d": {
      "value": 720,
      "unit": "count",
      "source": "fixture",
      "confidence": "measured",
      "coverage_pct": 100,
      "notes": ""
    },
    "vcs.active_authors_last_90d": {
      "value": 12,
      "unit": "count",
      "source": "fixture",
      "confidence": "measured",
      "coverage_pct": 100,
      "notes": ""
    },
    "vcs.total_authors": {
      "value": 45,
      "unit": "count",
      "source": "fixture",
      "confidence": "measured",
      "coverage_pct": 100,
      "notes": ""
    },
    "vcs.author_concentration_gini": {
      "value": 0.42,
      "unit": "gini",
      "source": "fixture",
      "confidence": "measured",
      "coverage_pct": 100,
      "notes": ""
    },
    "vcs.single_author_file_pct": {
      "value": 18.0,
      "unit": "pct",
      "source": "fixture",
      "confidence": "measured",
      "coverage_pct": 100,
      "notes": ""
    },
    "vcs.default_branch": {
      "value": "main",
      "unit": "",
      "source": "fixture",
      "confidence": "measured",
      "coverage_pct": 100,
      "notes": ""
    },
    "vcs.branch_count": {
      "value": 6,
      "unit": "count",
      "source": "fixture",
      "confidence": "measured",
      "coverage_pct": 100,
      "notes": ""
    },
    "vcs.stale_branch_count": {
      "value": 1,
      "unit": "count",
      "source": "fixture",
      "confidence": "measured",
      "coverage_pct": 100,
      "notes": ""
    },
    "vcs.merge_commit_ratio": {
      "value": 0.35,
      "unit": "ratio",
      "source": "fixture",
      "confidence": "measured",
      "coverage_pct": 100,
      "notes": ""
    },
    "vcs.commit_msg_issue_ref_pct": {
      "value": 72.0,
      "unit": "pct",
      "source": "fixture",
      "confidence": "measured",
      "coverage_pct": 100,
      "notes": ""
    },
    "vcs.hotspots": {
      "value": [
        {
          "path": "src/core/engine.py",
          "commits_365d": 40,
          "loc": 800,
          "authors": 6,
          "hotspot_score": 32000
        }
      ],
      "unit": "ranked_list",
      "source": "fixture",
      "confidence": "measured",
      "coverage_pct": 100,
      "notes": ""
    },
    "build.detected_systems": {
      "value": [
        "poetry"
      ],
      "unit": "list",
      "source": "fixture",
      "confidence": "measured",
      "coverage_pct": 100,
      "notes": ""
    },
    "build.containerized": {
      "value": true,
      "unit": "bool",
      "source": "fixture",
      "confidence": "measured",
      "coverage_pct": 100,
      "notes": ""
    },
    "build.devcontainer_present": {
      "value": true,
      "unit": "bool",
      "source": "fixture",
      "confidence": "measured",
      "coverage_pct": 100,
      "notes": ""
    },
    "build.one_command_build_documented": {
      "value": true,
      "unit": "bool",
      "source": "fixture",
      "confidence": "measured",
      "coverage_pct": 100,
      "notes": ""
    },
    "build.lockfiles_present": {
      "value": true,
      "unit": "bool",
      "source": "fixture",
      "confidence": "measured",
      "coverage_pct": 100,
      "notes": ""
    },
    "build.required_env_var_count": {
      "value": 2,
      "unit": "count",
      "source": "fixture",
      "confidence": "measured",
      "coverage_pct": 100,
      "notes": ""
    },
    "build.external_service_deps": {
      "value": [
        "postgres"
      ],
      "unit": "list",
      "source": "fixture",
      "confidence": "measured",
      "coverage_pct": 100,
      "notes": ""
    },
    "build.attempt": {
      "value": {
        "attempted": false,
        "exit_code": null,
        "duration_s": null,
        "stderr_tail": ""
      },
      "unit": "object",
      "source": "fixture",
      "confidence": "measured",
      "coverage_pct": 100,
      "notes": ""
    },
    "test.frameworks_detected": {
      "value": [
        "pytest"
      ],
      "unit": "list",
      "source": "fixture",
      "confidence": "measured",
      "coverage_pct": 100,
      "notes": ""
    },
    "test.test_file_count": {
      "value": 210,
      "unit": "count",
      "source": "fixture",
      "confidence": "measured",
      "coverage_pct": 100,
      "notes": ""
    },
    "test.test_to_source_ratio": {
      "value": 0.36,
      "unit": "ratio",
      "source": "fixture",
      "confidence": "measured",
      "coverage_pct": 100,
      "notes": ""
    },
    "test.coverage_pct": {
      "value": 85.0,
      "unit": "pct",
      "source": "fixture",
      "confidence": "measured",
      "coverage_pct": 100,
      "notes": ""
    },
    "test.coverage_source": {
      "value": "coverage.py",
      "unit": "",
      "source": "fixture",
      "confidence": "measured",
      "coverage_pct": 100,
      "notes": ""
    },
    "test.suite_executes": {
      "value": true,
      "unit": "bool",
      "source": "fixture",
      "confidence": "measured",
      "coverage_pct": 100,
      "notes": ""
    },
    "test.suite_duration_s": {
      "value": 95.0,
      "unit": "seconds",
      "source": "fixture",
      "confidence": "measured",
      "coverage_pct": 100,
      "notes": ""
    },
    "test.pass_rate": {
      "value": 99.5,
      "unit": "pct",
      "source": "fixture",
      "confidence": "measured",
      "coverage_pct": 100,
      "notes": ""
    },
    "test.flake_indicators": {
      "value": 0,
      "unit": "count",
      "source": "fixture",
      "confidence": "measured",
      "coverage_pct": 100,
      "notes": ""
    },
    "test.unit_present": {
      "value": true,
      "unit": "bool",
      "source": "fixture",
      "confidence": "measured",
      "coverage_pct": 100,
      "notes": ""
    },
    "test.integration_present": {
      "value": true,
      "unit": "bool",
      "source": "fixture",
      "confidence": "measured",
      "coverage_pct": 100,
      "notes": ""
    },
    "test.e2e_present": {
      "value": true,
      "unit": "bool",
      "source": "fixture",
      "confidence": "measured",
      "coverage_pct": 100,
      "notes": ""
    },
    "test.fixture_or_seed_data_present": {
      "value": true,
      "unit": "bool",
      "source": "fixture",
      "confidence": "measured",
      "coverage_pct": 100,
      "notes": ""
    },
    "ci.systems_detected": {
      "value": [
        "github-actions"
      ],
      "unit": "list",
      "source": "fixture",
      "confidence": "measured",
      "coverage_pct": 100,
      "notes": ""
    },
    "ci.runs_on_pr": {
      "value": true,
      "unit": "bool",
      "source": "fixture",
      "confidence": "measured",